{
  "active_phase": null,
  "artifact_role": "frozen_release_candidate_under_test",
  "baseline_commit": "739ee0a8db01f77143a5c993e6c68a56a772502b",
  "current_legacy_bioinformatics_route": "closed_biological_utility_gap",
  "epoch_id": "bioinformatics_submission_readiness_v2",
  "execution_mode": "gpu-screen",
  "external_comparison_authorized": false,
  "fixed_v2_artifact_storage_bytes": 68719476736,
  "last_completed_phase": 4,
  "last_decision": "performance_no_go",
  "output_schema": "gasal2_candidate_sites_tsv_v1",
  "phase_status": {
    "0": "pass",
    "1": "pass",
    "2": "pass",
    "3": "pass",
    "4": "no_go",
    "5": "not_authorized_previous_no_go",
    "6": "not_authorized_previous_no_go",
    "7": "not_authorized_previous_no_go"
  },
  "post_hoc_scope_decision": true,
  "product_status": "experimental",
  "program_name": "bioinformatics_submission_readiness_v2",
  "program_schema_version": 1,
  "proposed_v2_epoch_before_authorization": "not_started",
  "release_packaging_authorized": false,
  "scientific_contract": "biological_topk_candidate_site_v1",
  "software_epoch": "submission_rc_v2_2",
  "submission_drafting_authorized": false,
  "target_claim": "accelerates_short_query_candidate_site_screening_while_highly_preserving_fasim_topk_and_top1_with_comparable_performance_on_five_chirp_datasets",
  "target_claim_status": "not_supported",
  "validation_status": "failed",
  "v2_bioinformatics_route": "closed_performance_or_correctness_gap"
}
